================================================================================
HAND-OBJECT INTERACTION DETECTION EVALUATION REPORT
================================================================================

OVERALL STATISTICS
--------------------------------------------------------------------------------
Total narrations: 224
Narrations with detections: 161 (71.9%)
Narrations without detections: 63 (28.1%)
Detections outside narration ranges: 62

Total video duration: 394.72 seconds
Total narration time: 310.32 seconds
Narration coverage: 78.6% of video

================================================================================
COVERAGE DETAILS (Narrations with/without detections)
================================================================================

UNCOVERED NARRATIONS (63):
--------------------------------------------------------------------------------
ID: P01-20240202-110250-2
Time: 8.85s - 9.36s (duration: 0.51s)
Hands: ['left hand']
Narration:  Stretch the left hand inside the cupboard in the lower shelf to reach a mug at the far side of the cupboard.
Status: NO DETECTION FOUND

ID: P01-20240202-110250-4
Time: 11.15s - 11.60s (duration: 0.45s)
Hands: ['left hand']
Narration:  Turn the mug in the left hand to face the camera so as to check how clean it is.
Status: NO DETECTION FOUND

ID: P01-20240202-110250-5
Time: 11.50s - 12.18s (duration: 0.68s)
Hands: ['right hand']
Narration:  Close the cupboard using the right hand.
Status: NO DETECTION FOUND

ID: P01-20240202-110250-7
Time: 14.20s - 14.55s (duration: 0.35s)
Hands: ['right hand']
Narration:  Put the mug that is in the right hand under the nozzle of the coffee machine.
Status: NO DETECTION FOUND

ID: P01-20240202-110250-9
Time: 15.36s - 15.65s (duration: 0.29s)
Hands: ['right hand']
Narration:  Press down the button to turn on the coffee machine using the right hand.
Status: NO DETECTION FOUND

ID: P01-20240202-110250-10
Time: 16.06s - 16.64s (duration: 0.58s)
Hands: ['right hand']
Narration:  Lift the handle of the coffee machine using the right hand so that to expose the gap where the coffee capsule should fit.
Status: NO DETECTION FOUND

ID: P01-20240202-110250-15
Time: 22.10s - 23.47s (duration: 1.37s)
Hands: []
Narration:  Close the fridge.
Status: NO DETECTION FOUND

ID: P01-20240202-110250-17
Time: 25.75s - 26.80s (duration: 1.05s)
Hands: ['right hand', 'left hand']
Narration:  Open the milk bottle by holding it with the right hand, holding the lid with the left hand, and rotating the lid counterclockwise.
Status: NO DETECTION FOUND

ID: P01-20240202-110250-21
Time: 34.14s - 34.83s (duration: 0.69s)
Hands: ['left hand']
Narration:  Pick up the milk bottle from its handle using the left hand.
Status: NO DETECTION FOUND

ID: P01-20240202-110250-23
Time: 37.17s - 38.09s (duration: 0.92s)
Hands: ['left hand']
Narration:  Put down the milk bottle inside the fridge in the lower shelf of the door using the left hand.
Status: NO DETECTION FOUND

ID: P01-20240202-110250-24
Time: 38.02s - 38.64s (duration: 0.62s)
Hands: []
Narration:  Close the fridge.
Status: NO DETECTION FOUND

ID: P01-20240202-110250-31
Time: 55.26s - 55.62s (duration: 0.36s)
Hands: []
Narration:  Pick up a second orange from the mesh and place it to the left on the counter.
Status: NO DETECTION FOUND

ID: P01-20240202-110250-35
Time: 62.44s - 62.78s (duration: 0.34s)
Hands: ['right hand']
Narration:  Place the scissors inside the drawer using the right hand.
Status: NO DETECTION FOUND

ID: P01-20240202-110250-38
Time: 69.58s - 69.91s (duration: 0.33s)
Hands: ['right hand']
Narration:  Hold the plug of the food processor using the right hand.
Status: NO DETECTION FOUND

ID: P01-20240202-110250-39
Time: 70.27s - 70.55s (duration: 0.28s)
Hands: ['left hand']
Narration:  using the left hand, unplug another plug from the socket.
Status: NO DETECTION FOUND

ID: P01-20240202-110250-40
Time: 71.03s - 71.86s (duration: 0.83s)
Hands: ['left hand', 'right hand']
Narration:  Using the left hand, place the removed plug on the countertop, and using the right hand, plug the food processor's plug into this socket.
Status: NO DETECTION FOUND

ID: P01-20240202-110250-42
Time: 73.14s - 73.94s (duration: 0.80s)
Hands: ['left hand', 'right hand']
Narration:  Hold the bowl of the food processor using the left hand and use the right hand to turn the lid of the food processor counterclockwise to remove it from the bowl.
Status: NO DETECTION FOUND

ID: P01-20240202-110250-43
Time: 74.16s - 74.74s (duration: 0.58s)
Hands: ['right hand']
Narration:  Put down the lid on the shelf using the right hand.
Status: NO DETECTION FOUND

ID: P01-20240202-110250-50
Time: 90.63s - 91.38s (duration: 0.75s)
Hands: ['left hand']
Narration:  Hold the handle of the cupboard using the left hand and push it to close it fully.
Status: NO DETECTION FOUND

ID: P01-20240202-110250-56
Time: 100.09s - 100.94s (duration: 0.85s)
Hands: ['right hand']
Narration:  Turn the dial of the food processor using the right hand to start it on, checking that it works. You can hear the sound of the machine confirming that it's correctly now plugged in and working.
Status: NO DETECTION FOUND

ID: P01-20240202-110250-59
Time: 103.03s - 103.78s (duration: 0.75s)
Hands: []
Narration:  Place the orange on the chopping board.
Status: NO DETECTION FOUND

ID: P01-20240202-110250-64
Time: 116.01s - 116.68s (duration: 0.67s)
Hands: ['left hand', 'right hand']
Narration:  Hold the roll with the left hand. With the right hand, pull one bag out of the roll by tearing it at the right breaking point.
Status: NO DETECTION FOUND

ID: P01-20240202-110250-68
Time: 123.50s - 124.14s (duration: 0.64s)
Hands: ['both hands']
Narration:  Shake the bag using both hands twice to fully open it.
Status: NO DETECTION FOUND

ID: P01-20240202-110250-88
Time: 153.12s - 153.38s (duration: 0.26s)
Hands: ['right hand']
Narration:  using the right hand, open the lid of the trash bin.
Status: NO DETECTION FOUND

ID: P01-20240202-110250-90
Time: 154.06s - 154.29s (duration: 0.23s)
Hands: ['right hand']
Narration:  Close the cover of the trash bin using the right hand. This action occurs off screen, but we can hear it.
Status: NO DETECTION FOUND

ID: P01-20240202-110250-99
Time: 168.14s - 168.81s (duration: 0.67s)
Hands: ['right hand']
Narration:  Pick up the green sponge using the right hand.
Status: NO DETECTION FOUND

ID: P01-20240202-110250-104
Time: 173.24s - 173.62s (duration: 0.38s)
Hands: ['right hand']
Narration:  Close the water tap using the right hand.
Status: NO DETECTION FOUND

ID: P01-20240202-110250-106
Time: 175.59s - 176.51s (duration: 0.92s)
Hands: ['right hand']
Narration:  Return the cone which is in the right hand inside the milk frother.
Status: NO DETECTION FOUND

ID: P01-20240202-110250-107
Time: 178.33s - 178.72s (duration: 0.39s)
Hands: ['right hand']
Narration:  Place the milk frother on its base using the right hand.
Status: NO DETECTION FOUND

ID: P01-20240202-110250-118
Time: 202.24s - 202.65s (duration: 0.41s)
Hands: []
Narration:  Remove the orange half from the juicer, turning it to face the camera to check that all the juice has been removed and only the skin remains.
Status: NO DETECTION FOUND

ID: P01-20240202-110250-120
Time: 203.61s - 203.82s (duration: 0.21s)
Hands: []
Narration:  Throw the half orange skin inside the food recycling bin.
Status: NO DETECTION FOUND

ID: P01-20240202-110250-121
Time: 204.23s - 204.69s (duration: 0.46s)
Hands: ['right hand']
Narration:  Pick up the second half of the orange from the chopping board using the right hand.
Status: NO DETECTION FOUND

ID: P01-20240202-110250-125
Time: 217.02s - 217.81s (duration: 0.79s)
Hands: ['left hand']
Narration:  Turn off the food processor by rotating the dial using the left hand counter-clockwise.
Status: NO DETECTION FOUND

ID: P01-20240202-110250-126
Time: 218.13s - 218.48s (duration: 0.35s)
Hands: []
Narration:  Flip the orange half towards the camera to check that all the juice has been removed.
Status: NO DETECTION FOUND

ID: P01-20240202-110250-128
Time: 219.42s - 219.79s (duration: 0.37s)
Hands: ['right hand']
Narration:  throw the half orange skin inside the food processing bin using the right hand.
Status: NO DETECTION FOUND

ID: P01-20240202-110250-130
Time: 221.17s - 221.52s (duration: 0.35s)
Hands: []
Narration:  Place the orange on the chopping board.
Status: NO DETECTION FOUND

ID: P01-20240202-110250-134
Time: 225.14s - 225.51s (duration: 0.37s)
Hands: ['left hand', 'right hand']
Narration:  Pick up one of the halves of the orange using the left hand and pass it to the right hand.
Status: NO DETECTION FOUND

ID: P01-20240202-110250-135
Time: 225.69s - 225.96s (duration: 0.27s)
Hands: ['right hand']
Narration:  Flip the half of the orange using the right hand, place it downwards, facing downwards, on the cone of the juice processor.
Status: NO DETECTION FOUND

ID: P01-20240202-110250-136
Time: 226.22s - 226.57s (duration: 0.35s)
Hands: ['left hand']
Narration:  Switch the food processor on using the dial with the left hand rotating it clockwise.
Status: NO DETECTION FOUND

ID: P01-20240202-110250-139
Time: 238.05s - 238.77s (duration: 0.72s)
Hands: ['left hand', 'right hand']
Narration:  Open the lid of the food recycling bin using the left hand and remove the orange from the cone of the juicer using the right hand.
Status: NO DETECTION FOUND

ID: P01-20240202-110250-142
Time: 240.50s - 240.79s (duration: 0.29s)
Hands: []
Narration:  Place the half of the orange facing downwards on the cone of the juicer.
Status: NO DETECTION FOUND

ID: P01-20240202-110250-143
Time: 241.05s - 241.54s (duration: 0.49s)
Hands: ['left hand']
Narration:  Turn on the food processor by rotating the dial using the left hand clockwise.
Status: NO DETECTION FOUND

ID: P01-20240202-110250-150
Time: 255.12s - 255.62s (duration: 0.50s)
Hands: ['right hand']
Narration:  Pick up the knife using the right hand from the chopping board.
Status: NO DETECTION FOUND

ID: P01-20240202-110250-154
Time: 260.22s - 260.57s (duration: 0.35s)
Hands: ['right hand']
Narration:  Pick up half of the orange using the right hand from the chopping board.
Status: NO DETECTION FOUND

ID: P01-20240202-110250-164
Time: 280.47s - 280.77s (duration: 0.30s)
Hands: ['right hand']
Narration:  throw the orange half skin into the food processing bin using the right hand.
Status: NO DETECTION FOUND

ID: P01-20240202-110250-165
Time: 281.35s - 281.85s (duration: 0.50s)
Hands: ['right hand']
Narration:  Pick up the half orange using the right hand from the chopping board.
Status: NO DETECTION FOUND

ID: P01-20240202-110250-167
Time: 283.07s - 283.45s (duration: 0.38s)
Hands: ['left hand']
Narration:  Turn on the food processing machine using the dial, rotating it clockwise using the left hand.
Status: NO DETECTION FOUND

ID: P01-20240202-110250-174
Time: 301.60s - 301.95s (duration: 0.35s)
Hands: ['left hand']
Narration:  Open the lid of the food processing machine using the left hand.
Status: NO DETECTION FOUND

ID: P01-20240202-110250-175
Time: 302.05s - 302.30s (duration: 0.25s)
Hands: ['right hand']
Narration:  Throw the half orange skin into the food recycling bin using the right hand.
Status: NO DETECTION FOUND

ID: P01-20240202-110250-178
Time: 315.35s - 315.80s (duration: 0.45s)
Hands: ['right hand']
Narration:  Put the knife on the chopping board using the right hand.
Status: NO DETECTION FOUND

ID: P01-20240202-110250-180
Time: 318.55s - 318.80s (duration: 0.25s)
Hands: ['right hand']
Narration:  Shake the removed cone using the right hand to remove excess liquid.
Status: NO DETECTION FOUND

ID: P01-20240202-110250-183
Time: 322.51s - 322.87s (duration: 0.36s)
Hands: ['right hand']
Narration:  Pick up the sponge using the right hand.
Status: NO DETECTION FOUND

ID: P01-20240202-110250-186
Time: 325.24s - 325.80s (duration: 0.56s)
Hands: []
Narration:  Rinse the cone.
Status: NO DETECTION FOUND

ID: P01-20240202-110250-194
Time: 337.20s - 337.74s (duration: 0.54s)
Hands: []
Narration:  Close the food recycling bin's lid.
Status: NO DETECTION FOUND

ID: P01-20240202-110250-195
Time: 338.08s - 338.79s (duration: 0.71s)
Hands: []
Narration:  Place the juicer bowl under the nozzle of the tap.
Status: NO DETECTION FOUND

ID: P01-20240202-110250-198
Time: 341.41s - 341.86s (duration: 0.45s)
Hands: []
Narration:  Rotate the juicer bowl upwards.
Status: NO DETECTION FOUND

ID: P01-20240202-110250-203
Time: 352.10s - 352.89s (duration: 0.79s)
Hands: ['right hand']
Narration:  Open the cupboard using the right hand by holding its handle.
Status: NO DETECTION FOUND

ID: P01-20240202-110250-212
Time: 370.15s - 370.65s (duration: 0.50s)
Hands: []
Narration:  Place the bowl under the nozzle of the tap.
Status: NO DETECTION FOUND

ID: P01-20240202-110250-213
Time: 370.47s - 370.72s (duration: 0.25s)
Hands: []
Narration:  Open the cap so water flows to rinse the bowl of the food processor.
Status: NO DETECTION FOUND

ID: P01-20240202-110250-215
Time: 373.50s - 373.80s (duration: 0.30s)
Hands: []
Narration:  Close the tap.
Status: NO DETECTION FOUND

ID: P01-20240202-110250-216
Time: 374.15s - 374.50s (duration: 0.35s)
Hands: []
Narration:  Pick up the sponge.
Status: NO DETECTION FOUND

ID: P01-20240202-110250-218
Time: 380.50s - 380.85s (duration: 0.35s)
Hands: []
Narration:  Put down the sponge.
Status: NO DETECTION FOUND

ID: P01-20240202-110250-219
Time: 381.05s - 381.35s (duration: 0.30s)
Hands: []
Narration:  Open the tap.
Status: NO DETECTION FOUND

COVERED NARRATIONS (161):
--------------------------------------------------------------------------------
ID: P01-20240202-110250-1
Time: 7.44s - 8.75s
Detections: 1 at timestamps ['8.00s']

ID: P01-20240202-110250-3
Time: 9.34s - 11.16s
Detections: 2 at timestamps ['10.00s', '11.00s']

ID: P01-20240202-110250-6
Time: 13.73s - 14.11s
Detections: 1 at timestamps ['14.00s']

ID: P01-20240202-110250-8
Time: 14.81s - 15.08s
Detections: 1 at timestamps ['15.00s']

ID: P01-20240202-110250-11
Time: 16.08s - 17.26s
Detections: 1 at timestamps ['17.00s']

ID: P01-20240202-110250-12
Time: 17.40s - 18.02s
Detections: 1 at timestamps ['18.00s']

ID: P01-20240202-110250-13
Time: 19.75s - 21.10s
Detections: 2 at timestamps ['20.00s', '21.00s']

ID: P01-20240202-110250-14
Time: 21.40s - 22.00s
Detections: 1 at timestamps ['22.00s']

ID: P01-20240202-110250-16
Time: 24.55s - 25.50s
Detections: 1 at timestamps ['25.00s']

ID: P01-20240202-110250-18
Time: 27.00s - 27.50s
Detections: 1 at timestamps ['27.00s']

ID: P01-20240202-110250-19
Time: 27.61s - 33.79s
Detections: 6 at timestamps ['28.00s', '29.00s', '30.00s', '31.00s', '32.00s', '33.00s']

ID: P01-20240202-110250-20
Time: 30.70s - 32.40s
Detections: 2 at timestamps ['31.00s', '32.00s']

ID: P01-20240202-110250-22
Time: 36.07s - 37.07s
Detections: 1 at timestamps ['37.00s']

ID: P01-20240202-110250-25
Time: 41.19s - 42.43s
Detections: 1 at timestamps ['42.00s']

ID: P01-20240202-110250-26
Time: 48.28s - 49.29s
Detections: 1 at timestamps ['49.00s']

ID: P01-20240202-110250-27
Time: 49.54s - 50.04s
Detections: 1 at timestamps ['50.00s']

ID: P01-20240202-110250-28
Time: 50.17s - 51.04s
Detections: 1 at timestamps ['51.00s']

ID: P01-20240202-110250-29
Time: 51.41s - 52.71s
Detections: 1 at timestamps ['52.00s']

ID: P01-20240202-110250-30
Time: 53.31s - 54.11s
Detections: 1 at timestamps ['54.00s']

ID: P01-20240202-110250-32
Time: 56.60s - 57.98s
Detections: 1 at timestamps ['57.00s']

ID: P01-20240202-110250-33
Time: 58.66s - 60.48s
Detections: 2 at timestamps ['59.00s', '60.00s']

ID: P01-20240202-110250-34
Time: 61.54s - 62.54s
Detections: 1 at timestamps ['62.00s']

ID: P01-20240202-110250-36
Time: 64.86s - 65.84s
Detections: 1 at timestamps ['65.00s']

ID: P01-20240202-110250-37
Time: 66.20s - 68.92s
Detections: 2 at timestamps ['67.00s', '68.00s']

ID: P01-20240202-110250-41
Time: 71.93s - 72.49s
Detections: 1 at timestamps ['72.00s']

ID: P01-20240202-110250-44
Time: 76.15s - 78.00s
Detections: 2 at timestamps ['77.00s', '78.00s']

ID: P01-20240202-110250-45
Time: 81.51s - 82.59s
Detections: 1 at timestamps ['82.00s']

ID: P01-20240202-110250-46
Time: 84.55s - 85.23s
Detections: 1 at timestamps ['85.00s']

ID: P01-20240202-110250-47
Time: 85.85s - 87.47s
Detections: 2 at timestamps ['86.00s', '87.00s']

ID: P01-20240202-110250-48
Time: 87.21s - 89.05s
Detections: 2 at timestamps ['88.00s', '89.00s']

ID: P01-20240202-110250-49
Time: 89.36s - 90.29s
Detections: 1 at timestamps ['90.00s']

ID: P01-20240202-110250-51
Time: 93.43s - 94.65s
Detections: 1 at timestamps ['94.00s']

ID: P01-20240202-110250-52
Time: 94.49s - 95.36s
Detections: 1 at timestamps ['95.00s']

ID: P01-20240202-110250-53
Time: 95.46s - 97.82s
Detections: 2 at timestamps ['96.00s', '97.00s']

ID: P01-20240202-110250-54
Time: 97.92s - 98.88s
Detections: 1 at timestamps ['98.00s']

ID: P01-20240202-110250-55
Time: 98.98s - 100.14s
Detections: 2 at timestamps ['99.00s', '100.00s']

ID: P01-20240202-110250-57
Time: 100.90s - 101.71s
Detections: 1 at timestamps ['101.00s']

ID: P01-20240202-110250-58
Time: 101.81s - 102.93s
Detections: 1 at timestamps ['102.00s']

ID: P01-20240202-110250-60
Time: 103.88s - 104.92s
Detections: 1 at timestamps ['104.00s']

ID: P01-20240202-110250-61
Time: 105.13s - 106.10s
Detections: 1 at timestamps ['106.00s']

ID: P01-20240202-110250-62
Time: 106.20s - 108.67s
Detections: 2 at timestamps ['107.00s', '108.00s']

ID: P01-20240202-110250-63
Time: 108.64s - 116.04s
Detections: 8 at timestamps ['109.00s', '110.00s', '111.00s', '112.00s', '113.00s', '114.00s', '115.00s', '116.00s']

ID: P01-20240202-110250-65
Time: 116.76s - 117.80s
Detections: 1 at timestamps ['117.00s']

ID: P01-20240202-110250-66
Time: 117.89s - 118.65s
Detections: 1 at timestamps ['118.00s']

ID: P01-20240202-110250-67
Time: 119.51s - 123.38s
Detections: 4 at timestamps ['120.00s', '121.00s', '122.00s', '123.00s']

ID: P01-20240202-110250-69
Time: 124.43s - 125.09s
Detections: 1 at timestamps ['125.00s']

ID: P01-20240202-110250-70
Time: 125.19s - 127.90s
Detections: 2 at timestamps ['126.00s', '127.00s']

ID: P01-20240202-110250-71
Time: 127.89s - 128.68s
Detections: 1 at timestamps ['128.00s']

ID: P01-20240202-110250-72
Time: 128.91s - 129.68s
Detections: 1 at timestamps ['129.00s']

ID: P01-20240202-110250-73
Time: 130.41s - 131.13s
Detections: 1 at timestamps ['131.00s']

ID: P01-20240202-110250-74
Time: 130.81s - 132.82s
Detections: 2 at timestamps ['131.00s', '132.00s']

ID: P01-20240202-110250-75
Time: 132.85s - 133.86s
Detections: 1 at timestamps ['133.00s']

ID: P01-20240202-110250-76
Time: 136.35s - 137.31s
Detections: 1 at timestamps ['137.00s']

ID: P01-20240202-110250-77
Time: 136.72s - 137.47s
Detections: 1 at timestamps ['137.00s']

ID: P01-20240202-110250-78
Time: 137.25s - 138.07s
Detections: 1 at timestamps ['138.00s']

ID: P01-20240202-110250-79
Time: 137.70s - 139.91s
Detections: 2 at timestamps ['138.00s', '139.00s']

ID: P01-20240202-110250-80
Time: 139.92s - 142.80s
Detections: 3 at timestamps ['140.00s', '141.00s', '142.00s']

ID: P01-20240202-110250-81
Time: 141.14s - 143.10s
Detections: 2 at timestamps ['142.00s', '143.00s']

ID: P01-20240202-110250-82
Time: 143.45s - 144.89s
Detections: 1 at timestamps ['144.00s']

ID: P01-20240202-110250-83
Time: 144.86s - 145.16s
Detections: 1 at timestamps ['145.00s']

ID: P01-20240202-110250-84
Time: 145.29s - 147.12s
Detections: 2 at timestamps ['146.00s', '147.00s']

ID: P01-20240202-110250-85
Time: 147.02s - 149.77s
Detections: 2 at timestamps ['148.00s', '149.00s']

ID: P01-20240202-110250-86
Time: 149.86s - 150.78s
Detections: 1 at timestamps ['150.00s']

ID: P01-20240202-110250-87
Time: 150.73s - 151.61s
Detections: 1 at timestamps ['151.00s']

ID: P01-20240202-110250-89
Time: 153.63s - 154.08s
Detections: 1 at timestamps ['154.00s']

ID: P01-20240202-110250-91
Time: 155.41s - 156.08s
Detections: 1 at timestamps ['156.00s']

ID: P01-20240202-110250-92
Time: 157.91s - 158.57s
Detections: 1 at timestamps ['158.00s']

ID: P01-20240202-110250-93
Time: 158.37s - 159.53s
Detections: 1 at timestamps ['159.00s']

ID: P01-20240202-110250-94
Time: 159.45s - 160.94s
Detections: 1 at timestamps ['160.00s']

ID: P01-20240202-110250-95
Time: 160.97s - 161.81s
Detections: 1 at timestamps ['161.00s']

ID: P01-20240202-110250-96
Time: 161.40s - 162.72s
Detections: 1 at timestamps ['162.00s']

ID: P01-20240202-110250-97
Time: 162.94s - 163.36s
Detections: 1 at timestamps ['163.00s']

ID: P01-20240202-110250-98
Time: 163.58s - 165.86s
Detections: 2 at timestamps ['164.00s', '165.00s']

ID: P01-20240202-110250-100
Time: 168.74s - 169.51s
Detections: 1 at timestamps ['169.00s']

ID: P01-20240202-110250-101
Time: 168.70s - 170.55s
Detections: 2 at timestamps ['169.00s', '170.00s']

ID: P01-20240202-110250-102
Time: 170.35s - 172.23s
Detections: 2 at timestamps ['171.00s', '172.00s']

ID: P01-20240202-110250-103
Time: 172.24s - 173.08s
Detections: 1 at timestamps ['173.00s']

ID: P01-20240202-110250-105
Time: 174.12s - 175.54s
Detections: 1 at timestamps ['175.00s']

ID: P01-20240202-110250-108
Time: 179.06s - 180.18s
Detections: 1 at timestamps ['180.00s']

ID: P01-20240202-110250-109
Time: 180.72s - 182.56s
Detections: 2 at timestamps ['181.00s', '182.00s']

ID: P01-20240202-110250-110
Time: 183.89s - 184.12s
Detections: 1 at timestamps ['184.00s']

ID: P01-20240202-110250-111
Time: 184.78s - 186.73s
Detections: 2 at timestamps ['185.00s', '186.00s']

ID: P01-20240202-110250-112
Time: 186.95s - 187.53s
Detections: 1 at timestamps ['187.00s']

ID: P01-20240202-110250-113
Time: 187.89s - 188.28s
Detections: 1 at timestamps ['188.00s']

ID: P01-20240202-110250-114
Time: 188.63s - 189.03s
Detections: 1 at timestamps ['189.00s']

ID: P01-20240202-110250-115
Time: 189.37s - 193.13s
Detections: 4 at timestamps ['190.00s', '191.00s', '192.00s', '193.00s']

ID: P01-20240202-110250-116
Time: 193.02s - 200.78s
Detections: 7 at timestamps ['194.00s', '195.00s', '196.00s', '197.00s', '198.00s', '199.00s', '200.00s']

ID: P01-20240202-110250-117
Time: 200.91s - 201.67s
Detections: 1 at timestamps ['201.00s']

ID: P01-20240202-110250-119
Time: 203.00s - 203.36s
Detections: 1 at timestamps ['203.00s']

ID: P01-20240202-110250-122
Time: 204.77s - 205.41s
Detections: 1 at timestamps ['205.00s']

ID: P01-20240202-110250-123
Time: 205.51s - 206.20s
Detections: 1 at timestamps ['206.00s']

ID: P01-20240202-110250-124
Time: 206.38s - 216.88s
Detections: 10 at timestamps ['207.00s', '208.00s', '209.00s', '210.00s', '211.00s', '212.00s', '213.00s', '214.00s', '215.00s', '216.00s']

ID: P01-20240202-110250-127
Time: 218.64s - 219.53s
Detections: 1 at timestamps ['219.00s']

ID: P01-20240202-110250-129
Time: 220.62s - 221.00s
Detections: 1 at timestamps ['221.00s']

ID: P01-20240202-110250-131
Time: 221.79s - 222.11s
Detections: 1 at timestamps ['222.00s']

ID: P01-20240202-110250-132
Time: 222.27s - 224.42s
Detections: 2 at timestamps ['223.00s', '224.00s']

ID: P01-20240202-110250-133
Time: 224.56s - 225.01s
Detections: 1 at timestamps ['225.00s']

ID: P01-20240202-110250-137
Time: 226.85s - 235.75s
Detections: 9 at timestamps ['227.00s', '228.00s', '229.00s', '230.00s', '231.00s', '232.00s', '233.00s', '234.00s', '235.00s']

ID: P01-20240202-110250-138
Time: 235.84s - 237.27s
Detections: 2 at timestamps ['236.00s', '237.00s']

ID: P01-20240202-110250-140
Time: 238.72s - 239.02s
Detections: 1 at timestamps ['239.00s']

ID: P01-20240202-110250-141
Time: 239.49s - 240.39s
Detections: 1 at timestamps ['240.00s']

ID: P01-20240202-110250-144
Time: 241.69s - 250.28s
Detections: 9 at timestamps ['242.00s', '243.00s', '244.00s', '245.00s', '246.00s', '247.00s', '248.00s', '249.00s', '250.00s']

ID: P01-20240202-110250-145
Time: 250.37s - 251.32s
Detections: 1 at timestamps ['251.00s']

ID: P01-20240202-110250-146
Time: 251.67s - 252.52s
Detections: 1 at timestamps ['252.00s']

ID: P01-20240202-110250-147
Time: 252.72s - 253.07s
Detections: 1 at timestamps ['253.00s']

ID: P01-20240202-110250-148
Time: 253.67s - 254.52s
Detections: 1 at timestamps ['254.00s']

ID: P01-20240202-110250-149
Time: 254.62s - 255.02s
Detections: 1 at timestamps ['255.00s']

ID: P01-20240202-110250-151
Time: 255.14s - 258.70s
Detections: 3 at timestamps ['256.00s', '257.00s', '258.00s']

ID: P01-20240202-110250-152
Time: 258.71s - 259.00s
Detections: 1 at timestamps ['259.00s']

ID: P01-20240202-110250-153
Time: 259.10s - 260.24s
Detections: 1 at timestamps ['260.00s']

ID: P01-20240202-110250-155
Time: 260.67s - 261.37s
Detections: 1 at timestamps ['261.00s']

ID: P01-20240202-110250-156
Time: 261.77s - 262.02s
Detections: 1 at timestamps ['262.00s']

ID: P01-20240202-110250-157
Time: 262.35s - 273.07s
Detections: 11 at timestamps ['263.00s', '264.00s', '265.00s', '266.00s', '267.00s', '268.00s', '269.00s', '270.00s', '271.00s', '272.00s', '273.00s']

ID: P01-20240202-110250-158
Time: 273.40s - 274.16s
Detections: 1 at timestamps ['274.00s']

ID: P01-20240202-110250-159
Time: 274.81s - 275.39s
Detections: 1 at timestamps ['275.00s']

ID: P01-20240202-110250-160
Time: 275.50s - 276.16s
Detections: 1 at timestamps ['276.00s']

ID: P01-20240202-110250-161
Time: 276.54s - 277.88s
Detections: 1 at timestamps ['277.00s']

ID: P01-20240202-110250-162
Time: 277.93s - 278.83s
Detections: 1 at timestamps ['278.00s']

ID: P01-20240202-110250-163
Time: 279.71s - 280.39s
Detections: 1 at timestamps ['280.00s']

ID: P01-20240202-110250-166
Time: 282.15s - 283.36s
Detections: 1 at timestamps ['283.00s']

ID: P01-20240202-110250-168
Time: 284.00s - 292.80s
Detections: 9 at timestamps ['284.00s', '285.00s', '286.00s', '287.00s', '288.00s', '289.00s', '290.00s', '291.00s', '292.00s']

ID: P01-20240202-110250-169
Time: 292.98s - 294.49s
Detections: 2 at timestamps ['293.00s', '294.00s']

ID: P01-20240202-110250-170
Time: 295.08s - 296.85s
Detections: 1 at timestamps ['296.00s']

ID: P01-20240202-110250-171
Time: 296.34s - 297.90s
Detections: 1 at timestamps ['297.00s']

ID: P01-20240202-110250-172
Time: 298.69s - 299.80s
Detections: 1 at timestamps ['299.00s']

ID: P01-20240202-110250-173
Time: 300.20s - 301.66s
Detections: 1 at timestamps ['301.00s']

ID: P01-20240202-110250-176
Time: 302.99s - 303.72s
Detections: 1 at timestamps ['303.00s']

ID: P01-20240202-110250-177
Time: 303.62s - 314.83s
Detections: 11 at timestamps ['304.00s', '305.00s', '306.00s', '307.00s', '308.00s', '309.00s', '310.00s', '311.00s', '312.00s', '313.00s', '314.00s']

ID: P01-20240202-110250-179
Time: 317.05s - 318.45s
Detections: 1 at timestamps ['318.00s']

ID: P01-20240202-110250-181
Time: 319.88s - 320.61s
Detections: 1 at timestamps ['320.00s']

ID: P01-20240202-110250-182
Time: 320.71s - 322.43s
Detections: 2 at timestamps ['321.00s', '322.00s']

ID: P01-20240202-110250-184
Time: 322.97s - 324.61s
Detections: 2 at timestamps ['323.00s', '324.00s']

ID: P01-20240202-110250-185
Time: 324.71s - 325.24s
Detections: 1 at timestamps ['325.00s']

ID: P01-20240202-110250-187
Time: 325.91s - 326.48s
Detections: 1 at timestamps ['326.00s']

ID: P01-20240202-110250-188
Time: 326.89s - 327.39s
Detections: 1 at timestamps ['327.00s']

ID: P01-20240202-110250-189
Time: 329.17s - 330.55s
Detections: 1 at timestamps ['330.00s']

ID: P01-20240202-110250-190
Time: 330.32s - 337.09s
Detections: 7 at timestamps ['331.00s', '332.00s', '333.00s', '334.00s', '335.00s', '336.00s', '337.00s']

ID: P01-20240202-110250-191
Time: 331.96s - 333.19s
Detections: 2 at timestamps ['332.00s', '333.00s']

ID: P01-20240202-110250-192
Time: 333.57s - 334.53s
Detections: 1 at timestamps ['334.00s']

ID: P01-20240202-110250-193
Time: 334.56s - 336.72s
Detections: 2 at timestamps ['335.00s', '336.00s']

ID: P01-20240202-110250-196
Time: 338.79s - 339.68s
Detections: 1 at timestamps ['339.00s']

ID: P01-20240202-110250-197
Time: 339.08s - 341.62s
Detections: 2 at timestamps ['340.00s', '341.00s']

ID: P01-20240202-110250-199
Time: 341.73s - 345.83s
Detections: 4 at timestamps ['342.00s', '343.00s', '344.00s', '345.00s']

ID: P01-20240202-110250-200
Time: 345.77s - 346.26s
Detections: 1 at timestamps ['346.00s']

ID: P01-20240202-110250-201
Time: 346.95s - 347.50s
Detections: 1 at timestamps ['347.00s']

ID: P01-20240202-110250-202
Time: 349.64s - 351.24s
Detections: 1 at timestamps ['350.00s']

ID: P01-20240202-110250-204
Time: 353.33s - 354.22s
Detections: 1 at timestamps ['354.00s']

ID: P01-20240202-110250-205
Time: 355.72s - 356.22s
Detections: 1 at timestamps ['356.00s']

ID: P01-20240202-110250-206
Time: 356.40s - 357.02s
Detections: 1 at timestamps ['357.00s']

ID: P01-20240202-110250-207
Time: 357.51s - 358.69s
Detections: 1 at timestamps ['358.00s']

ID: P01-20240202-110250-208
Time: 358.59s - 359.31s
Detections: 1 at timestamps ['359.00s']

ID: P01-20240202-110250-209
Time: 359.63s - 360.12s
Detections: 1 at timestamps ['360.00s']

ID: P01-20240202-110250-210
Time: 360.37s - 364.00s
Detections: 4 at timestamps ['361.00s', '362.00s', '363.00s', '364.00s']

ID: P01-20240202-110250-211
Time: 367.30s - 368.20s
Detections: 1 at timestamps ['368.00s']

ID: P01-20240202-110250-214
Time: 370.77s - 374.05s
Detections: 4 at timestamps ['371.00s', '372.00s', '373.00s', '374.00s']

ID: P01-20240202-110250-217
Time: 374.60s - 380.30s
Detections: 6 at timestamps ['375.00s', '376.00s', '377.00s', '378.00s', '379.00s', '380.00s']

ID: P01-20240202-110250-220
Time: 381.45s - 386.40s
Detections: 5 at timestamps ['382.00s', '383.00s', '384.00s', '385.00s', '386.00s']

ID: P01-20240202-110250-221
Time: 386.46s - 387.10s
Detections: 1 at timestamps ['387.00s']

ID: P01-20240202-110250-222
Time: 386.66s - 387.65s
Detections: 1 at timestamps ['387.00s']

ID: P01-20240202-110250-223
Time: 386.83s - 389.94s
Detections: 2 at timestamps ['387.00s', '388.00s']

ID: P01-20240202-110250-224
Time: 391.66s - 394.72s
Detections: 3 at timestamps ['392.00s', '393.00s', '394.00s']

================================================================================
DETECTIONS OUTSIDE NARRATION RANGES (62)
================================================================================

These detections may indicate:
1. False positives from the detector
2. Interactions not captured in narrations
3. Timing misalignment between video and narrations

Timestamp: 16.00s
Hands detected: 1
Filename: P01-20240202-110250_frame_00480_ts_16.00.jpg

Timestamp: 19.00s
Hands detected: 1
Filename: P01-20240202-110250_frame_00570_ts_19.00.jpg

Timestamp: 34.00s
Hands detected: 2
Filename: P01-20240202-110250_frame_01020_ts_34.00.jpg

Timestamp: 36.00s
Hands detected: 1
Filename: P01-20240202-110250_frame_01080_ts_36.00.jpg

Timestamp: 40.00s
Hands detected: 1
Filename: P01-20240202-110250_frame_01200_ts_40.00.jpg

Timestamp: 41.00s
Hands detected: 1
Filename: P01-20240202-110250_frame_01230_ts_41.00.jpg

Timestamp: 43.00s
Hands detected: 1
Filename: P01-20240202-110250_frame_01290_ts_43.00.jpg

Timestamp: 53.00s
Hands detected: 2
Filename: P01-20240202-110250_frame_01590_ts_53.00.jpg

Timestamp: 55.00s
Hands detected: 2
Filename: P01-20240202-110250_frame_01650_ts_55.00.jpg

Timestamp: 56.00s
Hands detected: 2
Filename: P01-20240202-110250_frame_01680_ts_56.00.jpg

Timestamp: 58.00s
Hands detected: 2
Filename: P01-20240202-110250_frame_01740_ts_58.00.jpg

Timestamp: 66.00s
Hands detected: 2
Filename: P01-20240202-110250_frame_01980_ts_66.00.jpg

Timestamp: 70.00s
Hands detected: 2
Filename: P01-20240202-110250_frame_02100_ts_70.00.jpg

Timestamp: 71.00s
Hands detected: 2
Filename: P01-20240202-110250_frame_02130_ts_71.00.jpg

Timestamp: 73.00s
Hands detected: 2
Filename: P01-20240202-110250_frame_02190_ts_73.00.jpg

Timestamp: 74.00s
Hands detected: 2
Filename: P01-20240202-110250_frame_02220_ts_74.00.jpg

Timestamp: 75.00s
Hands detected: 1
Filename: P01-20240202-110250_frame_02250_ts_75.00.jpg

Timestamp: 76.00s
Hands detected: 1
Filename: P01-20240202-110250_frame_02280_ts_76.00.jpg

Timestamp: 92.00s
Hands detected: 2
Filename: P01-20240202-110250_frame_02760_ts_92.00.jpg

Timestamp: 93.00s
Hands detected: 1
Filename: P01-20240202-110250_frame_02790_ts_93.00.jpg

Timestamp: 103.00s
Hands detected: 2
Filename: P01-20240202-110250_frame_03090_ts_103.00.jpg

Timestamp: 105.00s
Hands detected: 2
Filename: P01-20240202-110250_frame_03150_ts_105.00.jpg

Timestamp: 119.00s
Hands detected: 1
Filename: P01-20240202-110250_frame_03570_ts_119.00.jpg

Timestamp: 130.00s
Hands detected: 2
Filename: P01-20240202-110250_frame_03900_ts_130.00.jpg

Timestamp: 134.00s
Hands detected: 1
Filename: P01-20240202-110250_frame_04020_ts_134.00.jpg

Timestamp: 136.00s
Hands detected: 2
Filename: P01-20240202-110250_frame_04080_ts_136.00.jpg

Timestamp: 153.00s
Hands detected: 1
Filename: P01-20240202-110250_frame_04590_ts_153.00.jpg

Timestamp: 155.00s
Hands detected: 1
Filename: P01-20240202-110250_frame_04650_ts_155.00.jpg

Timestamp: 157.00s
Hands detected: 1
Filename: P01-20240202-110250_frame_04710_ts_157.00.jpg

Timestamp: 166.00s
Hands detected: 2
Filename: P01-20240202-110250_frame_04980_ts_166.00.jpg

Timestamp: 167.00s
Hands detected: 1
Filename: P01-20240202-110250_frame_05010_ts_167.00.jpg

Timestamp: 168.00s
Hands detected: 1
Filename: P01-20240202-110250_frame_05040_ts_168.00.jpg

Timestamp: 174.00s
Hands detected: 2
Filename: P01-20240202-110250_frame_05220_ts_174.00.jpg

Timestamp: 177.00s
Hands detected: 2
Filename: P01-20240202-110250_frame_05310_ts_177.00.jpg

Timestamp: 178.00s
Hands detected: 1
Filename: P01-20240202-110250_frame_05340_ts_178.00.jpg

Timestamp: 179.00s
Hands detected: 1
Filename: P01-20240202-110250_frame_05370_ts_179.00.jpg

Timestamp: 202.00s
Hands detected: 2
Filename: P01-20240202-110250_frame_06060_ts_202.00.jpg

Timestamp: 204.00s
Hands detected: 1
Filename: P01-20240202-110250_frame_06120_ts_204.00.jpg

Timestamp: 217.00s
Hands detected: 2
Filename: P01-20240202-110250_frame_06510_ts_217.00.jpg

Timestamp: 218.00s
Hands detected: 2
Filename: P01-20240202-110250_frame_06540_ts_218.00.jpg

Timestamp: 226.00s
Hands detected: 2
Filename: P01-20240202-110250_frame_06780_ts_226.00.jpg

Timestamp: 238.00s
Hands detected: 2
Filename: P01-20240202-110250_frame_07140_ts_238.00.jpg

Timestamp: 241.00s
Hands detected: 2
Filename: P01-20240202-110250_frame_07230_ts_241.00.jpg

Timestamp: 279.00s
Hands detected: 2
Filename: P01-20240202-110250_frame_08370_ts_279.00.jpg

Timestamp: 281.00s
Hands detected: 2
Filename: P01-20240202-110250_frame_08430_ts_281.00.jpg

Timestamp: 282.00s
Hands detected: 2
Filename: P01-20240202-110250_frame_08460_ts_282.00.jpg

Timestamp: 295.00s
Hands detected: 2
Filename: P01-20240202-110250_frame_08850_ts_295.00.jpg

Timestamp: 298.00s
Hands detected: 2
Filename: P01-20240202-110250_frame_08940_ts_298.00.jpg

Timestamp: 300.00s
Hands detected: 2
Filename: P01-20240202-110250_frame_09000_ts_300.00.jpg

Timestamp: 302.00s
Hands detected: 2
Filename: P01-20240202-110250_frame_09060_ts_302.00.jpg

Timestamp: 315.00s
Hands detected: 2
Filename: P01-20240202-110250_frame_09450_ts_315.00.jpg

Timestamp: 316.00s
Hands detected: 2
Filename: P01-20240202-110250_frame_09480_ts_316.00.jpg

Timestamp: 317.00s
Hands detected: 2
Filename: P01-20240202-110250_frame_09510_ts_317.00.jpg

Timestamp: 338.00s
Hands detected: 2
Filename: P01-20240202-110250_frame_10140_ts_338.00.jpg

Timestamp: 349.00s
Hands detected: 2
Filename: P01-20240202-110250_frame_10470_ts_349.00.jpg

Timestamp: 352.00s
Hands detected: 1
Filename: P01-20240202-110250_frame_10560_ts_352.00.jpg

Timestamp: 355.00s
Hands detected: 1
Filename: P01-20240202-110250_frame_10650_ts_355.00.jpg

Timestamp: 365.00s
Hands detected: 2
Filename: P01-20240202-110250_frame_10950_ts_365.00.jpg

Timestamp: 366.00s
Hands detected: 1
Filename: P01-20240202-110250_frame_10980_ts_366.00.jpg

Timestamp: 370.00s
Hands detected: 2
Filename: P01-20240202-110250_frame_11100_ts_370.00.jpg

Timestamp: 381.00s
Hands detected: 2
Filename: P01-20240202-110250_frame_11430_ts_381.00.jpg

Timestamp: 391.00s
Hands detected: 2
Filename: P01-20240202-110250_frame_11730_ts_391.00.jpg

================================================================================
SUMMARY
================================================================================
Coverage Rate: 71.9% (161/224 narrations)
False Positive Rate: 62 detections outside narration ranges

⚠ 63 narrations missing detections
